{
  "definitions": {},
  "$schema": "http://json-schema.org/draft-07/schema#",
  "$id": "http://example.com/root.json",
  "type": "array",
  "title": "The Root Schema",
  "items": {
    "$id": "#/items",
    "type": "object",
    "title": "The Items Schema",
    "required": [
      "conditionId",
      "personId",
      "visitId",
      "conceptId",
      "additionalStandardConceptIds",
      "startDate",
      "startDatePrecision",
      "endDate",
      "endDatePrecision",
      "typeConceptId",
      "sourceConceptId"
    ],
    "properties": {
      "conditionId": {
        "$id": "#/items/properties/conditionId",
        "type": "string",
        "title": "The Conditionid Schema",
        "default": "",
        "examples": [
          "7df9675e-d490-4cf8-835d-e891cddeaaf5"
        ],
        "pattern": "^(.*)$"
      },
      "personId": {
        "$id": "#/items/properties/personId",
        "type": "string",
        "title": "The Personid Schema",
        "default": "",
        "examples": [
          "81163710-c2a2-4750-8e7f-8c7e18575695"
        ],
        "pattern": "^(.*)$"
      },
      "visitId": {
        "$id": "#/items/properties/visitId",
        "type": "string",
        "title": "The Visitid Schema",
        "default": "",
        "examples": [
          "9dd3d353-ae7d-4008-975c-c0bab77c36fe"
        ],
        "pattern": "^(.*)$"
      },
      "conceptId": {
        "$id": "#/items/properties/conceptId",
        "type": "string",
        "title": "The Conceptid Schema",
        "default": "",
        "examples": [
          "d9aa4199-a705-5166-9b67-c4f2ece1ccef"
        ],
        "pattern": "^(.*)$"
      },
      "additionalStandardConceptIds": {
        "$id": "#/items/properties/additionalStandardConceptIds",
        "type": "string",
        "title": "The Additionalstandardconceptids Schema",
        "default": "",
        "examples": [
          ""
        ],
        "pattern": "^(.*)$"
      },
      "startDate": {
        "$id": "#/items/properties/startDate",
        "type": "string",
        "title": "The Startdate Schema",
        "default": "",
        "examples": [
          ""
        ],
        "pattern": "^(.*)$"
      },
      "startDatePrecision": {
        "$id": "#/items/properties/startDatePrecision",
        "type": "string",
        "title": "The Startdateprecision Schema",
        "default": "",
        "examples": [
          ""
        ],
        "pattern": "^(.*)$"
      },
      "endDate": {
        "$id": "#/items/properties/endDate",
        "type": "string",
        "title": "The Enddate Schema",
        "default": "",
        "examples": [
          ""
        ],
        "pattern": "^(.*)$"
      },
      "endDatePrecision": {
        "$id": "#/items/properties/endDatePrecision",
        "type": "string",
        "title": "The Enddateprecision Schema",
        "default": "",
        "examples": [
          ""
        ],
        "pattern": "^(.*)$"
      },
      "typeConceptId": {
        "$id": "#/items/properties/typeConceptId",
        "type": "string",
        "title": "The Typeconceptid Schema",
        "default": "",
        "examples": [
          "f67d8cbc-98f8-5c90-9b03-155832f0d5cf"
        ],
        "pattern": "^(.*)$"
      },
      "sourceConceptId": {
        "$id": "#/items/properties/sourceConceptId",
        "type": "string",
        "title": "The Sourceconceptid Schema",
        "default": "",
        "examples": [
          "612b17bf-b1fe-5657-81aa-da16052978e6"
        ],
        "pattern": "^(.*)$"
      }
    }
  }
}